number,value,params_lncrna_weight,params_max_depth,params_max_features,params_min_samples_leaf,params_min_samples_split,params_n_estimators,state
0,0.9195249651324483,0.8474662085622164,,0.3,9,3,180,COMPLETE
1,0.9320063643920421,1.79441200597611,30.0,0.3,2,13,110,COMPLETE
2,0.9391230583504656,1.7114162022345731,100.0,0.2,9,20,260,COMPLETE
3,0.9426633910440666,4.941279156862903,,sqrt,2,12,60,COMPLETE
4,0.9478823555902617,5.807642547563794,50.0,0.3,4,17,80,COMPLETE
5,0.9198493186268761,0.5855459534005121,30.0,0.2,1,16,320,COMPLETE
6,0.934780946484458,1.4466526045160473,50.0,0.2,8,4,160,COMPLETE
7,0.9147449196339007,0.7463748450077031,30.0,log2,3,19,50,COMPLETE
8,0.9375588332153879,1.4450960696968438,30.0,log2,6,18,380,COMPLETE
9,0.9481886734415523,5.593697843542974,,sqrt,4,4,340,COMPLETE
10,0.9506164037870208,3.531113432660882,20.0,sqrt,6,7,400,COMPLETE
11,0.9503690944634554,3.4170275267228987,20.0,sqrt,6,7,400,COMPLETE
12,0.9415106918739015,3.141779157685739,20.0,0.5,6,8,400,COMPLETE
13,0.9509961941371632,3.261687024766574,20.0,sqrt,7,8,270,COMPLETE
14,0.9491451855435408,2.8132106486370287,20.0,sqrt,7,8,270,COMPLETE
15,0.9498118921132442,2.4813598757872075,20.0,sqrt,10,10,310,COMPLETE
16,0.9415738960650758,4.139451164085385,20.0,0.5,5,6,220,COMPLETE
17,0.9457255345516323,2.241753226338048,100.0,sqrt,7,10,350,COMPLETE
18,0.9538673912793936,3.9633872535268826,20.0,sqrt,8,14,280,COMPLETE
19,0.9546446554489599,4.233387545774506,20.0,sqrt,8,16,260,COMPLETE
20,0.9502854499700389,4.602233755780326,20.0,0.5,10,15,220,COMPLETE
21,0.9540022553126116,4.024987193731037,20.0,sqrt,8,14,270,COMPLETE
22,0.9546191586951974,4.138558845812502,20.0,sqrt,8,14,290,COMPLETE
23,0.9470340245881367,2.279974988178205,20.0,sqrt,8,15,240,COMPLETE
24,0.9569441463315981,4.63782025833122,20.0,log2,9,12,190,COMPLETE
25,0.9575891289133889,5.1299599361719315,100.0,log2,9,11,190,COMPLETE
26,0.9571420122937292,4.701735955478487,100.0,log2,9,11,160,COMPLETE
27,0.9586606785850891,5.86292620521752,100.0,log2,9,11,160,COMPLETE
28,0.0,5.909392105524644,100.0,log2,10,10,130,COMPLETE
29,0.9247906222764947,0.9867430519559082,100.0,log2,9,11,170,COMPLETE
30,0.9578992088310728,5.229921426123315,100.0,log2,9,11,140,COMPLETE
31,0.9579035128374941,5.216521468750769,100.0,log2,9,11,140,COMPLETE
32,0.9585978876545648,5.27585535583516,100.0,log2,10,12,120,COMPLETE
33,0.0,5.909419660875929,100.0,log2,10,12,120,COMPLETE
34,0.9579911485074749,5.14861932787868,100.0,log2,10,9,90,COMPLETE
35,0.9495487600786925,3.559613531782971,100.0,0.3,10,9,90,COMPLETE
36,0.9525214236752256,2.809122744679191,100.0,log2,10,13,90,COMPLETE
37,0.957444376775622,5.252836300123405,100.0,log2,9,9,70,COMPLETE
38,0.9541707764896129,4.654976257995648,50.0,0.2,10,13,100,COMPLETE
39,0.9249667335592388,1.0134439780566138,,0.3,9,2,140,COMPLETE
40,0.9417343295073864,1.7912103766266618,100.0,log2,7,5,110,COMPLETE
41,0.9580290522951364,5.2436729424473265,100.0,log2,9,12,140,COMPLETE
42,0.0,5.334786858234625,100.0,log2,10,12,150,COMPLETE
43,0.0,5.982061881169951,100.0,log2,9,9,50,COMPLETE
44,0.9547657500614216,3.7906329327973167,30.0,log2,8,13,120,COMPLETE
45,0.9576581303226391,4.839425684836125,100.0,log2,9,10,200,COMPLETE
46,0.9366963126304227,2.893638140094936,,0.2,2,12,80,COMPLETE
47,0.8909818262631148,0.5358646286077325,50.0,log2,10,7,110,COMPLETE
48,0.9390339102130058,1.5014977987619476,100.0,log2,10,9,170,COMPLETE
49,0.948596459074803,5.463223017138103,100.0,0.3,4,20,70,COMPLETE
50,0.9540700196068275,4.381087772396077,30.0,log2,5,17,150,COMPLETE
51,0.9579108209139737,5.29576662855376,100.0,log2,9,11,130,COMPLETE
52,0.9577080457968767,4.955721636664466,100.0,log2,9,10,130,COMPLETE
53,0.9489607775780803,5.500010916115739,100.0,0.5,8,11,90,COMPLETE
54,0.9534200670734844,3.62677425015651,100.0,log2,7,8,120,COMPLETE
55,0.9568749386686667,4.433791610456824,100.0,log2,9,13,170,COMPLETE
56,0.9525348255122745,3.907526427976303,50.0,0.2,10,12,140,COMPLETE
57,0.9576601499605889,5.5917965851494555,100.0,log2,8,10,200,COMPLETE
58,0.9572534819279414,5.072830078268273,,log2,9,15,100,COMPLETE
59,0.9221157535398232,0.6970968744884909,100.0,0.5,1,14,160,COMPLETE
60,0.9527701723420976,3.3579810258006852,100.0,log2,8,8,60,COMPLETE
61,0.9576648136796203,5.0922949212970785,100.0,log2,9,11,130,COMPLETE
62,0.9565920271035336,4.376663725379719,100.0,log2,9,11,140,COMPLETE
63,0.0,5.458753858845339,100.0,log2,10,11,180,COMPLETE
64,0.9576572168443449,4.8523989143791635,100.0,log2,9,9,150,COMPLETE
65,0.0,5.970488484013225,30.0,log2,10,12,100,COMPLETE
66,0.9558943617261141,4.06299595372383,100.0,log2,8,13,110,COMPLETE
67,0.9520511244917093,4.350175751408416,100.0,0.3,10,10,230,COMPLETE
68,0.9575917542009919,5.080864377086344,100.0,log2,9,7,130,COMPLETE
69,0.9455245894972869,1.9660621774714222,100.0,log2,9,11,180,COMPLETE
70,0.9494097719418404,3.008273689200292,50.0,0.2,10,12,80,COMPLETE
71,0.9572859441503301,4.735822554710041,100.0,log2,9,9,130,COMPLETE
72,0.957631164008487,5.575124139113219,100.0,log2,8,10,150,COMPLETE
73,0.9566953520667845,4.949272086141794,100.0,log2,8,10,160,COMPLETE
74,0.9584577706268181,5.275419580195331,100.0,log2,10,11,120,COMPLETE
75,0.9558423003628883,3.8012169691836206,100.0,log2,10,12,110,COMPLETE
76,0.9524909735739192,5.989918008964324,,0.5,10,13,120,COMPLETE
77,0.9317217596857201,1.2040415437391017,100.0,log2,10,11,140,COMPLETE
78,0.9561986380877853,4.512758179782692,100.0,log2,9,14,70,COMPLETE
79,0.0,5.39909203113444,30.0,log2,10,12,100,COMPLETE
80,0.9500330045511299,4.0864553955336715,100.0,0.3,9,9,80,COMPLETE
81,0.9570051124428772,4.876883793813478,100.0,log2,9,10,120,COMPLETE
82,0.9579300232860618,5.153523522775545,100.0,log2,9,11,140,COMPLETE
83,0.0,5.672970715381003,100.0,log2,10,11,150,COMPLETE
84,0.9575641459153914,5.163110992786441,100.0,log2,9,13,140,COMPLETE
85,0.9570151003103572,5.271703000019928,100.0,log2,8,11,160,COMPLETE
86,0.9570721585101486,4.602800824188179,100.0,log2,9,12,180,COMPLETE
87,0.9568912392401696,4.1935498575019965,100.0,log2,10,6,90,COMPLETE
88,0.9563221850669663,5.695364412903632,100.0,log2,7,8,120,COMPLETE
89,0.9466037844607019,3.7172001506852506,50.0,0.2,5,13,200,COMPLETE
90,0.9503281290948387,2.5414216211185923,,log2,9,10,100,COMPLETE
91,0.9573809062766605,4.822807655968677,100.0,log2,9,10,130,COMPLETE
92,0.9576005483025977,5.22733224766183,100.0,log2,9,11,140,COMPLETE
93,0.9577621065144588,4.612966510363048,100.0,log2,10,9,130,COMPLETE
94,0.9576587214440178,4.578534105280967,100.0,log2,10,8,110,COMPLETE
95,0.958053864396804,5.660230960686642,100.0,sqrt,10,9,170,COMPLETE
96,0.9581935837373848,5.619214530799529,100.0,sqrt,10,12,170,COMPLETE
97,0.9485686450475197,5.608818186648331,100.0,sqrt,3,12,170,COMPLETE
98,0.9577610767644208,5.361267547184507,100.0,sqrt,10,14,190,COMPLETE
99,0.9584246879992002,5.997245328775243,30.0,sqrt,10,11,160,COMPLETE
100,0.9582950329620014,5.799377069427542,30.0,sqrt,10,12,170,COMPLETE
101,0.9583942760477955,5.785631860942795,30.0,sqrt,10,12,210,COMPLETE
102,0.9584675106953067,5.827279859731752,30.0,sqrt,10,12,210,COMPLETE
103,0.9585197645151676,5.697405441456784,30.0,sqrt,10,12,250,COMPLETE
104,0.9584888385210671,5.873777375736773,30.0,sqrt,10,13,250,COMPLETE
105,0.9581891281994063,5.924730945970802,30.0,sqrt,10,14,250,COMPLETE
106,0.9586071751893962,5.966661206010042,30.0,sqrt,10,14,260,COMPLETE
107,0.958457750868575,5.979415808276165,30.0,sqrt,10,15,220,COMPLETE
108,0.9584272131206789,5.866182129340135,30.0,sqrt,10,16,210,COMPLETE
109,0.9584414440699424,5.943454775319907,30.0,sqrt,10,16,220,COMPLETE
110,0.9582780823971057,5.823245155803835,30.0,sqrt,10,16,240,COMPLETE
111,0.9585255303080845,5.946083742806106,30.0,sqrt,10,17,210,COMPLETE
112,0.9581396236963199,5.506402023537708,30.0,sqrt,10,17,230,COMPLETE
113,0.9584888298432923,5.927032977914624,30.0,sqrt,10,18,290,COMPLETE
114,0.9574846151270521,4.930877944302517,30.0,sqrt,10,18,310,COMPLETE
115,0.9585216981194004,5.48401036978017,30.0,sqrt,10,16,280,COMPLETE
116,0.958064931236725,5.418397873772807,30.0,sqrt,10,15,290,COMPLETE
117,0.9581429079875815,5.414928617344436,30.0,sqrt,10,17,260,COMPLETE
118,0.9575945182406437,5.0314317613840736,30.0,sqrt,10,18,240,COMPLETE
119,0.9585116700677544,5.956243799117213,30.0,sqrt,10,15,280,COMPLETE
120,0.9574596125743723,4.898507581463248,30.0,sqrt,10,19,300,COMPLETE
121,0.9580688409245575,5.646284187522292,30.0,sqrt,10,15,280,COMPLETE
122,0.9587573895774608,5.989335520027035,30.0,sqrt,10,17,270,COMPLETE
123,0.9581583732161576,5.41964614291014,30.0,sqrt,10,19,270,COMPLETE
124,0.9583423477653125,5.993371232174444,30.0,sqrt,10,17,260,COMPLETE
125,0.9575480009995031,5.116939842703335,30.0,sqrt,10,18,280,COMPLETE
126,0.9580657213241136,5.620709686832458,30.0,sqrt,10,16,250,COMPLETE
127,0.9539097567708854,4.751688706651809,30.0,sqrt,6,15,290,COMPLETE
128,0.9578343725153028,5.306332816523815,30.0,sqrt,10,17,250,COMPLETE
129,0.9582872706895592,5.989238710147472,30.0,sqrt,10,14,280,COMPLETE
130,0.958409622706443,5.650106235853184,30.0,sqrt,10,16,320,COMPLETE
131,0.9580604657473573,5.397829377321217,30.0,sqrt,10,16,220,COMPLETE
132,0.9582292160685834,5.7287130801010555,30.0,sqrt,10,15,240,COMPLETE
133,0.9585226538547222,5.971587837288933,30.0,sqrt,10,18,220,COMPLETE
134,0.9573160062468545,5.11675868575704,30.0,sqrt,10,18,270,COMPLETE
135,0.9579137140529755,5.490132505953311,30.0,sqrt,10,19,260,COMPLETE
136,0.9508864455255157,5.008507472250321,30.0,0.5,10,17,210,COMPLETE
137,0.9585450480456247,5.997598933403074,30.0,sqrt,10,14,290,COMPLETE
138,0.9580109105130649,5.253126999627826,30.0,sqrt,10,18,300,COMPLETE
139,0.9407008513077321,1.5670392934967399,30.0,sqrt,10,20,300,COMPLETE
140,0.9530406346230964,5.648908597771057,30.0,0.3,9,13,270,COMPLETE
141,0.9505096084104773,5.726873901926409,30.0,sqrt,3,14,230,COMPLETE
142,0.9583599950745244,5.982956691054161,30.0,sqrt,10,15,280,COMPLETE
143,0.9578341453112609,5.346628482118007,30.0,sqrt,10,14,350,COMPLETE
144,0.9155623681399484,0.7918942964295328,20.0,sqrt,10,13,250,COMPLETE
145,0.9577467343524573,5.549003665460856,30.0,sqrt,10,17,260,COMPLETE
146,0.9584311210983151,5.958262143051033,30.0,sqrt,10,14,290,COMPLETE
147,0.9572178562059371,4.757802424157598,30.0,sqrt,10,13,310,COMPLETE
148,0.9325950413364749,1.2935662535064039,30.0,0.2,10,16,230,COMPLETE
149,0.9576973801029657,5.124277537869787,30.0,sqrt,10,18,210,COMPLETE
150,0.9573967522891472,5.703553238899287,30.0,sqrt,9,15,200,COMPLETE
151,0.9585950416994539,5.986147840283579,30.0,sqrt,10,15,220,COMPLETE
152,0.9584812766733232,5.997072725369174,30.0,sqrt,10,15,220,COMPLETE
153,0.9579602798862855,5.414586468154129,50.0,sqrt,10,17,270,COMPLETE
154,0.9456880523169847,1.969747395852481,30.0,sqrt,10,13,240,COMPLETE
155,0.9583210757646444,5.694098570163886,30.0,sqrt,10,19,290,COMPLETE
156,0.9517136313963803,5.287327661891522,,0.5,10,15,190,COMPLETE
157,0.9576202974861054,5.9857071824070465,30.0,sqrt,9,16,230,COMPLETE
158,0.9573785433795986,4.98265112661588,30.0,sqrt,10,14,220,COMPLETE
159,0.9482617717789471,5.5431153117196885,30.0,sqrt,2,15,320,COMPLETE
160,0.9585621679691236,5.711387052641665,30.0,sqrt,10,13,250,COMPLETE
161,0.9580417857735041,5.752221400477116,30.0,sqrt,10,13,250,COMPLETE
162,0.9581337931198982,5.444393748756568,30.0,sqrt,10,12,260,COMPLETE
163,0.9578834129061077,5.185786758617285,30.0,sqrt,10,14,270,COMPLETE
164,0.9585092153782783,5.980848701711351,30.0,sqrt,10,13,200,COMPLETE
165,0.9582370023518143,5.679808622066451,30.0,sqrt,10,14,210,COMPLETE
166,0.9529929472570351,5.990997655122312,30.0,sqrt,4,14,240,COMPLETE
167,0.9583479954681545,5.701716287847509,30.0,sqrt,10,13,200,COMPLETE
168,0.9578374914838083,5.465126921049366,30.0,sqrt,10,13,280,COMPLETE
169,0.9581595976908774,5.976279078901441,20.0,sqrt,9,17,230,COMPLETE
170,0.9530929457127814,4.902613861771522,30.0,0.3,10,12,200,COMPLETE
171,0.9576898505870258,5.304270905133538,30.0,sqrt,10,16,220,COMPLETE
172,0.958123485751666,5.652233842826621,30.0,sqrt,10,12,250,COMPLETE
173,0.9582659116263953,5.712166296551318,30.0,sqrt,10,18,190,COMPLETE
174,0.9069060365371425,0.652125414834847,30.0,sqrt,10,15,290,COMPLETE
175,0.9561326042472998,5.985271724608273,30.0,0.2,10,12,280,COMPLETE
176,0.9233176877872676,0.9462523507113834,50.0,sqrt,10,13,210,COMPLETE
177,0.9578042701513922,5.206691150611261,30.0,sqrt,10,13,260,COMPLETE
178,0.9579896378341299,5.462565216562952,,sqrt,10,15,240,COMPLETE
179,0.9585836876183307,5.986013482748664,30.0,sqrt,10,11,300,COMPLETE
180,0.9576998504682631,5.7407709197375985,30.0,sqrt,9,14,300,COMPLETE
181,0.9584432253726423,5.968054887269338,30.0,sqrt,10,11,300,COMPLETE
182,0.9578361425530844,5.484421882426239,30.0,sqrt,10,11,270,COMPLETE
183,0.9588898316326618,5.988346544075297,30.0,sqrt,10,12,310,COMPLETE
184,0.9582787502271731,5.661576940713403,30.0,sqrt,10,12,310,COMPLETE
185,0.9584868027256475,5.967183861375456,30.0,sqrt,10,12,320,COMPLETE
186,0.9586444660791913,5.955306187747439,30.0,sqrt,10,13,330,COMPLETE
187,0.9581635487308461,5.452452055323,30.0,sqrt,10,13,330,COMPLETE
188,0.9578797091703358,5.096461806350806,30.0,sqrt,10,13,340,COMPLETE
189,0.9584160490139687,5.71734781121675,30.0,sqrt,10,12,310,COMPLETE
190,0.9524566247747593,5.983922828666445,30.0,0.5,10,12,330,COMPLETE
191,0.958807181504254,5.981771770878591,30.0,sqrt,10,14,330,COMPLETE
192,0.9582255734861683,5.535398608783697,30.0,sqrt,10,14,340,COMPLETE
193,0.9581893852142498,5.73663553996595,30.0,sqrt,10,13,330,COMPLETE
194,0.9567925371912196,5.99516251812617,30.0,sqrt,6,18,320,COMPLETE
195,0.9582339379163135,5.298884403729448,30.0,sqrt,10,13,350,COMPLETE
196,0.9579021378860123,5.52415961870993,30.0,sqrt,10,14,320,COMPLETE
197,0.9586702622679049,5.996157960952106,30.0,sqrt,10,3,370,COMPLETE
198,0.9585297585802895,5.729613428656764,30.0,sqrt,10,17,290,COMPLETE
199,0.9580074334271304,5.267042489083201,20.0,sqrt,10,3,380,COMPLETE
